{
  "$schema": "https://json-schema.org/draft/2020-12/schema",
  "$id": "https://woodshop.dev/schemas/nest_parts.output.json",
  "title": "NestPartsOutput",
  "type": "object",
  "additionalProperties": false,
  "properties": {
    "project_id": { "$ref": "./common.schema.json#/$defs/projectId" },
    "strategy": { "type": "string" },
    "seed": { "$ref": "./common.schema.json#/$defs/seedOutput" },
    "layouts": {
      "type": "array",
      "items": { "$ref": "./common.schema.json#/$defs/nestLayout" }
    },
    "utilization_summary": {
      "type": "object",
      "additionalProperties": false,
      "properties": {
        "total_parts_area_mm2": { "type": "number" },
        "total_stock_area_mm2": { "type": "number" },
        "overall_utilization": { "type": "number" }
      },
      "required": ["total_parts_area_mm2", "total_stock_area_mm2", "overall_utilization"]
    },
    "offcuts": {
      "type": "array",
      "items": { "$ref": "./common.schema.json#/$defs/nestOffcut" }
    },
    "not_placed": {
      "type": "array",
      "items": { "type": "string" },
      "default": []
    },
    "engine_versions": { "$ref": "./common.schema.json#/$defs/engineVersions" },
    "revision_id": { "$ref": "./common.schema.json#/$defs/revisionId" },
    "inputs_hash": { "$ref": "./common.schema.json#/$defs/inputsHash" }
  },
  "required": [
    "project_id",
    "strategy",
    "seed",
    "layouts",
    "utilization_summary",
    "offcuts",
    "not_placed",
    "engine_versions",
    "revision_id",
    "inputs_hash"
  ]
}
