{
  "engine_versions": {
    "cam": "0.0.0",
    "nest": "0.0.0",
    "occt": "0.0.0",
    "schemas": "0.0.0",
    "wood": "0.0.0"
  },
  "inputs_hash": "792aa0bdb47e5fa62949e755df48c90ac0fa22dee6c28cfc84bc4339e4ec2e69",
  "layouts": [
    {
      "placements": [
        {
          "instance": 0,
          "length_mm": 1200,
          "part_id": "proj_842ca66e834c::back_panel",
          "rotation_deg": 0,
          "width_mm": 762,
          "x_mm": 0,
          "y_mm": 0
        },
        {
          "instance": 0,
          "length_mm": 1200,
          "part_id": "proj_842ca66e834c::panel_bottom",
          "rotation_deg": 0,
          "width_mm": 400,
          "x_mm": 765,
          "y_mm": 0
        },
        {
          "instance": 0,
          "length_mm": 1200,
          "part_id": "proj_842ca66e834c::panel_top",
          "rotation_deg": 0,
          "width_mm": 400,
          "x_mm": 0,
          "y_mm": 1203
        },
        {
          "instance": 0,
          "length_mm": 1150,
          "part_id": "proj_842ca66e834c::shelf_mid",
          "rotation_deg": 0,
          "width_mm": 380,
          "x_mm": 403,
          "y_mm": 1203
        },
        {
          "instance": 0,
          "length_mm": 762,
          "part_id": "proj_842ca66e834c::panel_side_a",
          "rotation_deg": 0,
          "width_mm": 381,
          "x_mm": 786,
          "y_mm": 1203
        }
      ],
      "sheet_id": "2440x1220",
      "sheet_index": 0,
      "svg_path": "artifacts/nest/proj_842ca66e834c/seed-0-sheet-1.svg",
      "used_area_mm2": 2601722,
      "utilization": 0.874
    },
    {
      "placements": [
        {
          "instance": 1,
          "length_mm": 762,
          "part_id": "proj_842ca66e834c::panel_side_a",
          "rotation_deg": 0,
          "width_mm": 381,
          "x_mm": 0,
          "y_mm": 0
        },
        {
          "instance": 0,
          "length_mm": 762,
          "part_id": "proj_842ca66e834c::panel_side_b",
          "rotation_deg": 0,
          "width_mm": 381,
          "x_mm": 384,
          "y_mm": 0
        },
        {
          "instance": 1,
          "length_mm": 762,
          "part_id": "proj_842ca66e834c::panel_side_b",
          "rotation_deg": 0,
          "width_mm": 381,
          "x_mm": 768,
          "y_mm": 0
        }
      ],
      "sheet_id": "2440x1220",
      "sheet_index": 1,
      "svg_path": "artifacts/nest/proj_842ca66e834c/seed-0-sheet-2.svg",
      "used_area_mm2": 870966,
      "utilization": 0.2926
    }
  ],
  "not_placed": [],
  "offcuts": [
    {
      "area_mm2": 375078,
      "bounding_box_mm": {
        "length": 1240,
        "width": 1220
      },
      "sheet_id": "2440x1220"
    },
    {
      "area_mm2": 2105834,
      "bounding_box_mm": {
        "length": 1678,
        "width": 1220
      },
      "sheet_id": "2440x1220"
    }
  ],
  "project_id": "proj_842ca66e834c",
  "revision_id": "d1fe083eb15cbc8d24463137ac0e7f5cd2d5b4ec",
  "seed": 0,
  "strategy": "skyline",
  "utilization_summary": {
    "overall_utilization": 0.5833,
    "total_parts_area_mm2": 3472688,
    "total_stock_area_mm2": 5953600
  }
}
