{
  "project_id": "proj_demo",
  "strategy": "skyline",
  "seed": 11,
  "layouts": [
    {
      "sheet_id": "sheet-1",
      "sheet_index": 1,
      "utilization": 0.68,
      "used_area_mm2": 512000,
      "svg_path": "artifacts/nest/proj_demo/seed-11-sheet-1.svg",
      "placements": [
        {
          "part_id": "proj_demo::panel_side_a",
          "instance": 0,
          "x_mm": 0,
          "y_mm": 0,
          "width_mm": 381,
          "length_mm": 762,
          "rotation_deg": 0
        },
        {
          "part_id": "proj_demo::panel_side_b",
          "instance": 0,
          "x_mm": 400,
          "y_mm": 0,
          "width_mm": 381,
          "length_mm": 762,
          "rotation_deg": 0
        }
      ]
    }
  ],
  "utilization_summary": {
    "total_parts_area_mm2": 512000,
    "total_stock_area_mm2": 752800,
    "overall_utilization": 0.68
  },
  "offcuts": [
    {
      "sheet_id": "sheet-1",
      "area_mm2": 240800,
      "bounding_box_mm": {
        "length": 1200,
        "width": 200
      }
    }
  ],
  "not_placed": [],
  "engine_versions": {
    "occt": "0.0.0",
    "nest": "0.0.0",
    "cam": "0.0.0",
    "wood": "0.0.0",
    "schemas": "0.0.0"
  },
  "revision_id": "rev_local",
  "inputs_hash": "d4735e3a265e16eee03f59718b9b5d03019c07d8b6c3e5612f632d30dff43b11"
}
